Company Name,Company LinkedIn,Description
E-commerce Agency | ,https://www.linkedin.com/company/e-commerce-agency,E-commerce Agency | 52 followers on LinkedIn. We Help E-commerce Businesses Scale To 7-8 ... View all 2 employees ... THE ECOM KING. Advertising Services ...
Shoplanders - ,https://www.linkedin.com/company/shoplanders,"Data Driven eCommerce Agency | eCommerce agency specializing in design, development and ecommerce marketing solutions for global ... View all 2 employees ..."
Ecomm Growth Agency | ,https://www.linkedin.com/company/ecomm-growth-agency,"Ecomm Growth Agency | 55 followers on LinkedIn. ... Barbara. View all 2 employees ... Marketing, Web Design, Social Growth, Strategy, Paid Media, Ecommerce, ..."
Ecomcy - ,https://www.linkedin.com/company/ecomcy,"View all 2 employees. About us. We are an Amazon Service Provider Agency with all the certifications. ... Ecommerce Manager jobs. 84,439 open jobs ..."
R & W Media - Magento eCommerce Agency - ,https://www.linkedin.com/company/r-&-w-media,R & W Media - Magento eCommerce Agency | 62 followers on LinkedIn. We design and build exceptional Magento eCommerce ... Steven Craig. View all 2 employees ...
Nakatori | creative e-commerce agency - ,https://www.linkedin.com/company/nakatori,"Nakatori is a digital creative agency specialised in e-commerce and design. We build digital flagship stores, ... Tim Marcel. View all 2 employees ..."
eCom Collab Club™ (TheFlameCo.com  ) | ,https://www.linkedin.com/company/ecom-collab-club,"Adam Peter. View all 2 employees ... Ecommerce Collab Club brings together eCommerce agencies and tech partners under 1 warm, caffeinated roof."
Alioned Agency - ,https://www.linkedin.com/company/alioned/,Alioned Agency | 31 followers on LinkedIn. Alioned is a Marketing and Web Design agency specializing in Shopify eCommerce stores. ... View all 2 employees ...
eCom Underground - ,https://www.linkedin.com/company/ecomunderground,We help eCommerce Sellers escape the stranglehold of Amazon and give them peace of ... View all 2 employees ... Essence of Email - Email Marketing Agency.
The Make Group - ,https://www.linkedin.com/company/themakegroupltd,The Global Direct To Consumer Agency | The Make Group is an eCommerce and digital agency focused on helping brands make the most of ... View all 2 employees ...
Sentry eCom - ,https://www.linkedin.com/company/sentry-ecom?trk=similar-pages,Sentry eCom | 625 followers on LinkedIn. eCommerce Marketing Agency helping brands profitably scale and reach new milestones via ... View all 2 employees ...
ScaleJet | HR partner agency for e-commerce brands - ,https://www.linkedin.com/company/scale-jet,We help e-commerce brands build A-players teams ||| HR partner agency for ... the standard corporate structure that doesn't suit an eCommerce business.
VIXXR - ,https://www.linkedin.com/company/vixxr-shopify-agency,Because having been both a Magento partner agency and a Shopify agency we have ... much you are missing out on and how much simpler your ecommerce could be.
Bullseye Agency - ,https://www.linkedin.com/company/the-bullseye-agency,Bullseye Agency | 10 followers on LinkedIn. International High Performance Advertising Agency for ecommerce and local busineses. ... View all 2 employees ...
Cavallo Agency | ,https://www.linkedin.com/company/cavallo-agency,"Cavallo Agency | 20 followers on LinkedIn. Web Design, Ecommerce, & Lead Generation Firm in Philadelphia, PA | Cavallo Agency is ... View all 2 employees ..."
Focus Ecommerce and Marketing - ,https://www.linkedin.com/company/focusecommerce,Focus Ecommerce and Marketing | 216 followers on LinkedIn. ... View all 2 employees ... At Focus Ecommerce and Marketing Full Service Commerce Agency.
Business of eCommerce - ,https://www.linkedin.com/company/business-of-ecommerce,Business of eCommerce | 25 followers on LinkedIn. ... Ahmad Hafiz. View all 2 employees ... E-Business Brain - eCommerce Marketing Agency.
FGG- Ecommerce Launch&Develop- Digital Marketing Agnecy ...,https://www.linkedin.com/company/linkedinfuturegengrp,FGG- Ecommerce Launch&Develop- Digital Marketing Agnecy | 64 followers on LinkedIn. Providing services to Launch & Develop ... View all 2 employees ...
RS Web Design Agency - ,https://www.linkedin.com/company/rswebdesign?trk=similar-pages,RS Web Design Agency | 26 followers on LinkedIn. ... experiences for eCommerce startups through web design and augmented reality. ... View all 2 employees ...
Idea Pioneer Media LLC - eCommerce Digital Marketing Agency,https://www.linkedin.com/company/ideapioneer-media,"... eCommerce Digital Marketing Agency. Advertising Services. Dripping Spgs, TX 40 followers. See jobs Follow · Report this company. Leslie 飞. View all 2 ..."
Provision Ecommerce Company | ,https://www.linkedin.com/company/provision-ecommerce-company,"Provision Ecommerce Company | 134 followers on LinkedIn. ... Ayodele. View all 2 employees ... We are a small, boutique agency doing big things. Stay tuned!"
AG media - Ecommerce Development Agency | ,https://www.linkedin.com/company/ag-media-d.o.o.,"We are a Ecommerce Development and full service digital creative agency based in Zagreb, Croatia. ... Tomislav Filip. View all 2 employees ..."
Jukkie Digital Agency - ,https://www.linkedin.com/company/jukkie-digital-agency,"Jukkie Digital Agency | 35 followers on LinkedIn. ... View all 2 employees ... Social Media, Digital Strategy, ECommerce, CMS, Wordpress, Digital Agency, ..."
Fuel Digital - ,https://www.linkedin.com/company/fuel-digital786,An eCommerce agency Solutions for Businesses! | Fuel Digital is a full-Scale eCommerce agency that offers complete solutions to ... View all 2 employees ...
eCommerce Hospitality Consultants - ,https://www.linkedin.com/company/ecommerce-hospitality-consultants,eCommerce Hospitality Consultants | 48 followers on LinkedIn. eCommerce has long been ... Soknov. View all 2 employees ... TLG - The eCommerce Agency.
Messenger Mastermind - ,https://www.linkedin.com/company/messenger-mastermind,Ecommerce Consulting Agency helping growing eCommerce companies connect with their customers in new owned channels. ... View all 2 employees ...
eCommerce Specialist - ,https://www.linkedin.com/company/e-handelseksperten,eCommerce Specialist | 58 followers on LinkedIn. ... Charlie. View all 2 employees ... Finley Design - Digital Website Agency and Ecommerce specialist.
Lewis Creative Digital Commerce - ,https://www.linkedin.com/company/lewis,"We are Lewis, an award winning design & eCommerce agency for Fashion, Lifestyle & Luxury sectors. Based in the heart of Soho, ... View all 2 employees ..."
ILOVEFASHIONRETAIL.COM - ,https://www.linkedin.com/company/ilovefashionretail,Put our fashion eCommerce experience to work for your fashion business. We invite you to learn about our Fashion Digital Marketing Agency services.
Sister the Agency - ,https://www.linkedin.com/company/sister-the-agency,"Sister the Agency | 34 followers on LinkedIn. ... Full funnel Ecommerce services, incl: - Digital Strategy - Branding for Online ... View all 2 employees ..."
Organic Ecommerce Ltd - ,https://www.linkedin.com/company/organicecommerce,"Offering Healthy Sustainable Growth to your business | Organic Ecommerce (OEC) ... which allows us to offer from simple online marketing agency tasks, ..."
Ecom Atlas | ,https://www.linkedin.com/company/ecomatlas,Ecom Atlas | 43 followers on LinkedIn. Helping DTC eCommerce brands grow profitably with growth marketing strategies. ... View all 2 employees ...
EC Marketing Agency | ,https://www.linkedin.com/company/ec-marketing-agency,EC Marketing Agency | 21 followers on LinkedIn. ... Daniela. View all 2 employees ... Idea Pioneer Media LLC - eCommerce Digital Marketing Agency.
Performly Digital Marketing for eCommerce - ,https://www.linkedin.com/company/performly-digital-marketing-for-ecommerce,eCommerce Pay On Performance Digital Marketing Agency | Performly is an eCommerce performance agency comprised of a team of ... View all 2 employees ...
NEXTSCLICK DIGITAL - ,https://www.linkedin.com/company/nextsclick,eCommerce Marketing Agency We do Performance Marketing & Management for E-COMMERCE Brands. Our successful result-driven strategies ... View all 2 employees ...
MakkPress Technologies AB | ,https://www.linkedin.com/company/makkpress-technologies-ab/,"View all 2 employees ... WordPress Development, Ecommerce Development, Ecommerce Website Development, Digital Marketing Agency, Search Engine Optimisation, ..."
Bridge Road Marketing - ,https://www.linkedin.com/company/bridge-road-marketing,"... ""Agency Quality- Old School Service""​. We offer a wide range of services ranging from website design and development, eCommerce design & development, ..."
Catapult eCommerce - ,https://www.linkedin.com/company/etailing-solutions,"Formerly Etailing-Solutions, Catapult eCommerce is now a division of Catapult Marketing, the #1 Shopper Marketing Agency as voted by The Hub 2014."
UAB Media - ,https://www.linkedin.com/company/growth-in-consulting,View all 2 employees ... Early stage Ecommerce brands and real estate agents who are looking to aggressively scale their business and are able to commit to ...
Lead eCom Expert | ,https://www.linkedin.com/company/lead-ecom-expert,"Lead eCom Expert | 35 followers on LinkedIn. ... View all 2 employees ... Specialties: ecommerce, B2B lead Generation , and Digital Marketing Agency ..."
Ecommerce Brand Academy - ,https://www.linkedin.com/company/ecommercebrandacademy,Ecommerce Brand Academy | 29 followers on LinkedIn. eCommerce Brand Academy is an all ... View all 2 employees ... VASO Group - eCommerce Brand Agency.
The Missing Link | ,https://www.linkedin.com/company/tmladvertising,The Fireproof agency helping eCommerce businesses connect with the right consumers. | The Missing Link is a digital advertising ... View all 2 employees ...
Exhibea - ,https://www.linkedin.com/company/exhibea,"Exhibea — An eCommerce agency for luxury, fashion and lifestyle brands. See jobs Follow · Report this company. Umer. View all 2 employees ..."
Aquitude Group - The Experience Agency - ,https://www.linkedin.com/company/aquitude,Aquitude Group - The Experience Agency | 97 followers on LinkedIn. Talent. ... View all 2 employees ... Our Melbourne office specialises in B2B Ecommerce.
54 Bit Studios | ,https://www.linkedin.com/company/54-bit-studios,"A boutique eCommerce agency for growing businesses | We design, build and maintain next-gen ecommerce websites that work harder for ... View all 2 employees ..."
Quo Agency Inc. - ,https://www.linkedin.com/company/quoagency,"Quo Agency Inc. | 45 followers on LinkedIn. ... View all 2 employees ... Quo Agency, Inc. | Characteristics of the eCommerce product listing page on…"
Intelmais Agência Ecommerce - ,https://www.linkedin.com/company/intelmais-ecommerce,"Intelmais Agência Ecommerce | 27 followers on LinkedIn. ... We are a Full Service Ecommmerce Agency, established in 2010, ... View all 2 employees ..."
XO Pandora - ,https://www.linkedin.com/company/xopandora,"Bay Area web development agency providing website, eCommerce, E-mail Marketing and Digital Marketing services. ... Jake Eliza. View all 2 employees ..."
"Deep Field, Inc. - The Shopify Marketing Agency | ",https://www.linkedin.com/company/deep-field-inc.,"Deep Field, Inc. - The Shopify Marketing Agency ... View all 2 employees ... Tavano Team | #1 eCommerce Agency | NetSuite | Shopify | BigCommerce."
AS WEB DESIGNER | ,https://www.linkedin.com/company/as-web-designer,"Creative Graphic, WordPress, Shopify, WooCommerce, eCommerce Web Design Agency helping new and old store owners succeed. ... View all 2 employees ..."
Cart Consultant (Bigcommerce Agency) - ,https://www.linkedin.com/company/cartconsultant,Cart Consultant (Bigcommerce Agency) | 103 followers on LinkedIn. ... We are a web design firm focused on Bigcommerce. ... View all 2 employees ...
Briveon - ,https://www.linkedin.com/company/briveon,View all 2 employees. About us. Briveon is an E-Commerce Consulting and Digital Marketing Agency. The company has been partnering up with online brands and ...
KiwiCommerce - ,https://www.linkedin.com/company/kiwicommerce-gb,"View all 2 employees. About us. KiwiCommerce is a specialist eCommerce agency with a strong focus on creating bespoke, search friendly and technically ..."
Intensify - ,https://www.linkedin.com/company/intensify-inc,"View all 2 employees ... Data Analysis, Web Design, Digital Advertising, Ecommerce Marketing, ... It's shocking that even Nike makes ecommerce mistakes!"
Rocket Website Agency Ltd - ,https://www.linkedin.com/company/rocket-website-agency,Rocket Website Agency Ltd | 28 followers on LinkedIn. Magento 2 eCommerce Agency in London. | Rocket Website Agency ... Mikhail Sergii. View all 2 employees ...
Thooja - ,https://www.linkedin.com/company/thooja,"Our goal is to increase your ecommerce revenue. ... As a certified Shopify Partner, our Irish-based ecommerce agency helps brands ... View all 2 employees ..."
The Styles Agency - ,https://www.linkedin.com/company/thestylesagency,The Styles Agency | 45 followers on LinkedIn. ... View all 2 employees ... #bossbabe #babessupportbabes #boutiquebabe #smallbusinesslife #ecommerce #seo.
Velocity Commerce Group - ,https://www.linkedin.com/company/velocity-commerce-group,"View all 2 employees ... platforms be Amazon, other pure play eCommerce partners or omni-channel retailers like Walmart and Target. ... VA | Amazon Agency."
Forge Digital Marketing - ,https://www.linkedin.com/company/forge-digital-marketing,"View all 2 employees ... We rank #1 on Google for competitive keywords like ""ecommerce marketing agency"", “CBD marketing agency” and “supplement marketing ..."
brandempwr - ,https://www.linkedin.com/company/brandempwr,"Specialties: branding, brand development, graphic design, web design, ... Page speed is one of the most important factors of an Ecommerce store and often ..."
MM:Growth | Inbound Marketing Agency - ,https://www.linkedin.com/company/mmgrowth,MM:Growth | Inbound Marketing Agency | 600 followers on LinkedIn. Inbound and content marketing for growth minded ... Damien Dominic. View all 2 employees ...
LeoBrains | ,https://www.linkedin.com/company/leobrains,|Top Marketing Agency For Amazon| Ecommerce Experts| Brand & Strategy Partner| | LEOBRAINS is one of the top digital marketing ... View all 2 employees ...
eHeights Agency | ,https://www.linkedin.com/company/eheights-agency,Paid Ads Agency; E-commerce is our bread and butter; we propel brands into ... View all 2 employees ... Head Of Ecommerce jobs · Director Of Ecommerce jobs.
Scale-Me - ,https://www.linkedin.com/company/scale-me,Growing your eCommerce business with exclusive AI technology | We will grow your business by putting exclusive Artificial ... Ron gad. View all 2 employees ...
"Great Northern Products, Inc. - ",https://www.linkedin.com/company/great-northern-products,"A B2B Ecommerce Agency. Technical, Engineering B2B sales distribution, online since 2004. | An Ecommerce Agency. ... Michelle. View all 2 employees ..."
360 The Amazon Agency - ,https://www.linkedin.com/company/amazon-agency360,360 The Amazon Agency | 208 followers on LinkedIn. ... View all 2 employees ... Nuanced Media: eCommerce & Amazon Marketing Services Agency.
Accudy - ,https://www.linkedin.com/company/accudy,"CMS, Web design, eCommerce website design, mobile app development agency | Accudy is a leading Digital Agency in London . ... View all 2 employees ..."
Better World Products (Amazon Agency) - ,https://www.linkedin.com/company/betterworldproducts,"Amazon Marketing Agency offering Listing Optimization, ... View all 2 employees ... Nuanced Media: eCommerce & Amazon Marketing Services Agency."
Lizard Strategy | ,https://www.linkedin.com/company/lizard-media---content-commerce-and-operational-strategy,"Business Consulting and Services. New York, NY 13 followers. Ecommerce and Shoppable Content Agency. See jobs Follow. Elizabeth. View all 2 employees."
NoCoast Pro - ,https://www.linkedin.com/company/nocoast-hosting,NoCoast Pro is a digitally focused eCommerce agency specializing in PHP based technologies. NoCoast is best at providing responsive ... View all 2 employees ...
Delta Ecommerce | ,https://www.linkedin.com/company/delta-ecommerce?trk=similar-pages_result-card_full-click,Delta Ecommerce | 130 followers on LinkedIn. ... Report this company. My Max. View all 2 employees ... The Cast Agency. Advertising Services ...
Tuna Ecommerce Partners | ,https://www.linkedin.com/company/tuna-digital-nz?trk=similar-pages,Tuna Ecommerce Partners | 5 followers on LinkedIn. We are not a digital agency. We do not sell solutions. ... Andre Jake. View all 2 employees ...
Eco D2C | ,https://www.linkedin.com/company/eco-d2c,"Scaling ecommerce sales for natural products, clean tech, ... 3Rock Agency | Conversion Orientated Amazon Marketing & Advertising Management Agency."
ASP.net ecommerce software with content management and ...,https://www.linkedin.com/company/ablecommerce,"Report this company. Mike. View all 2 employees ... SuiteDB | ERP & eCommerce Agency | NetSuite Alliance Partner. Software Development. Miami, Florida ..."
Oxford Web Services - ,https://www.linkedin.com/company/oxford-web-services,Web Design + eCommerce Development – SEO Agency for Businesses and Individuals | Looking for an experienced team? ... View all 2 employees ...
GetGrowth Digital - ,https://www.linkedin.com/company/getgrowthdigital,"Scaling 6/7/8 Figure Brands on Amazon | Amazon Partner Agency | Rocket Fuel for your ... Ecommerce Marketing, Direct to Consumer, and Marketing Strategy ..."
Strivent Marketing - ,https://www.linkedin.com/company/striventmarketing,Supercharge your online sales through Facebook Advertising. | Ecommerce Growth Marketing Agency. ... Report this company. Enver Kreso. View all 2 employees ...
maxemus Digital Marketing | ,https://www.linkedin.com/company/maxemus-digital-marketing/,"We're not your traditional digital marketing agency. Powered by data and fuelled by passion, we transform businesses. | We help conscientious eCommerce ..."
Customer First Digital - ,https://www.linkedin.com/company/customer-first-digital,"View all 2 employees ... In fact, we work on a non-compete basis for those agencies who need additional support across their client portfolio."
Parallel 9 - ,https://www.linkedin.com/company/parallel9,We're the Digital Marketing agency for scaling eCommerce brands globally. | Parallel 9 is a modern consulting ... Mario Dimitris. View all 2 employees ...
"B.brand Agency, Inc. - ",https://www.linkedin.com/company/b-brand-agency,"B.brand Agency, Inc. | 58 followers on LinkedIn. ... View all 2 employees ... B.brand Agency, Inc. #SocialMedia #SaaS #B2B #ecommerce #MarketingTips #Tech ..."
Ventorq - ,https://www.linkedin.com/company/ventorq,Benefits of working with Ventorq ecommerce consultancy Value - As a value driven business ... View all 2 employees ... blubolt - Shopify Plus Partner Agency.
MageCaptain - ,https://www.linkedin.com/company/magecaptain,Magecaptain is a team of Magento enthusiasts aiming to help merchants/agencies worldwide with our Magento development services to improve the eCommerce ...
Ecommerce Brokers - ,https://www.linkedin.com/company/hsc-notes,Ecommerce-Brokers.com is a brokerage agency that sells ecommerce brands and ... The value of Ecommerce Brokers is in its advisors. ... View all 2 employees ...
Just 99 Marketing - ,https://www.linkedin.com/company/just-99-marketing,View all 2 employees ... for a web design & marketing agency that can build your dream eCommerce site? Just 99 Marketing specializes in eCommerce sites!
Gromedia Web Agency Ltd - ,https://www.linkedin.com/company/gromedia-web-design,"Gromedia Web Agency Ltd | 57 followers on LinkedIn. ... View all 2 employees ... search engine optimisation, graphic design, eCommerce web design, ..."
FOMO agency - ,https://www.linkedin.com/company/fomoagency,"FOMO agency | 102 followers on LinkedIn. ... View all 2 employees ... Specialties: eCommerce, Web Development, Apps, Retail, Project Consulting, ..."
Agency One Five - ,https://www.linkedin.com/company/agencyonefive,"Agency One Five | 88 followers on LinkedIn. ... View all 2 employees ... Among other things, our sandbox is focused on ecommerce and customer experience, ..."
Synarcon - Digital Agency - ,https://www.linkedin.com/company/synarcon,"Synarcon - Digital Agency | 21 followers on LinkedIn. We work with businesses to help grow their online presence. We offer web development, ecommerce, SEO, ..."
Adzeem.Digital - ,https://www.linkedin.com/company/adzeem-digital?trk=similar-pages,"View all 2 employees ... Adzeem is more than just an SEO or Social Media agency. ... Video Optimization SEO, Ecommerce Web Design, and Video SEO ..."
Ecom Digital Romania - ,https://www.linkedin.com/company/ecom-digital-romania,Ecom Digital Romania | 10 followers on LinkedIn. ... View all 2 employees. About us. Full Stack Digital Marketing Agency with 11 years of experience.
Lizard Strategy | ,https://www.linkedin.com/company/lizard-strategy,"Ecommerce and Shoppable Content Agency | Lizard Strategy is an ecommerce consultancy specializing in customer segmentation, ... View all 2 employees ..."
Belle Digital | ,https://www.linkedin.com/company/belle-digital,Belle Digital is an ecommerce design agency based in London and Officially ranked Shopify's No 1 Expert in Shopify Setups. ... Nicola. View all 2 employees ...
That Media Team - ,https://www.linkedin.com/company/thatmediateam,That Media Team specialise in direct response campaigns for eCommerce and mail order ... That Media Team are an independent media agency planning and buying ...
BlckPanda Creative | ,https://www.linkedin.com/company/blckpanda,Marketing | Digital & Graphic Design | Web Development | eCommerce Marketing | Corporate Focused Digital Marketing Agency. ... View all 2 employees ...
IM Technologies - Digital Marketing Agency | ,https://www.linkedin.com/company/im-technologies---digital-marketing-agency,"IM Technologies - Digital Marketing Agency ... View all 2 employees ... Ecommerce Development, Digital Marketing Agency in Gurgaon, Social Media Agency, ..."
Airia Creative - ,https://www.linkedin.com/company/airiacreative,"Airia Creative is a Denver digital marketing agency focused a more scientific ... Copy Writing, Marketing, Social Media Management, Ecommerce, and PPC ..."
Moose Made Media - ,https://www.linkedin.com/company/moose-made-media,"eCommerce Digital Agency - No Bullshit, Just Results! We will build your site and grow your ... Report this company. Moose Autumn. View all 2 employees ..."
Wild Fix Media: Facebook Advertising specialist ∣ Marketing ...,https://www.linkedin.com/company/digital-marketing-specialist-fb,Mario Calvin. View all 2 employees ... eCommerce Marketing Specialist at… See all employees ... Advanced Media Agency: Google Advertising Specialist.
