Company Name,Link,Description
Magnolia Bakery | Home,https://www.magnoliabakery.com/,"Classic American baked goods and desserts like our world famous banana pudding, cakes and cupcakes. Order them online to ship nationwide or pick up in ..."
Carlo's Bakery - Nationwide Shipping & Local Pickup,https://carlosbakery.com/,"Jan 1, 2020 — Carlo's Bakery, as featured on TLC's Cake Boss, is known for our delicious pastries, desserts & cakes. Shop local or online—we ship ..."
"Baked by Melissa: Cupcake Delivery, Send Nationwide!",https://www.bakedbymelissa.com/,"Hand-crafted, mini cupcakes and macarons in a variety of always-changing flavors. Founded in 2008 by Melissa Ben-Ishay, she still bakes up every single ..."
Sweet E's Bake Shop | Logo cookies and celebration cakes,https://www.sweetesbakeshop.com/,Gorgeous treats that taste great from Los Angeles bakery: next day + same day delivery and nationwide shipping. Logo and photo cookies shipped fast ...
"Piece of Cake: Cakes, cupcakes, gifts, treats - Order Online ...",https://www.pieceofcakeinc.com/,"Our loyal customers love the taste and quality of our baked goods - Piece of Cake is consistently exceptional. Since 1985, we have been baking cakes and ..."
SusieCakes,https://susiecakes.com/,Celebrating Everyone. Proceeds from all Pride Rainbow Swoosh Cakes and Pride Cupcakes sold through July 31st will be donated to local nonprofits. Order Now ...
Shop FRESH Bakery Online in Baltimore Washington ...,http://www.freshbakeryonline.com/,At Fresh Bakery Online get the simple and satisfying southern style desserts and baked goods. For a better experience in the Baltimore/Washington ...
Sweet Stuff Bake Shop,https://sweetstuffbakeshop.com/,"We create high-quality, custom baked goods for all of your occasions. Everything is made fresh to order using only the best ingredients. Our cakes, cookies, ..."
By the Way Bakery,https://www.btwbakery.com/,"By the Way Bakery is an old-fashioned bakery where everything is made by hand, from scratch, in small batches. And, by the way, all of our baked goods are ..."
Janie's Life Changing Baked Goods,https://janiebakes.com/,"HOME OF THE PIE CRUST COOKIE Visit us at 212 w 80th in NYC. Shop now ... Since 2015, Janie's has been changing lives with baked goods."
Welcome to Bittersweet Pastry Shop,https://bittersweetpastry.com/,"The legacy of Bittersweet Pastry Shop continues. This landmark Chicago bakery creates classic desserts, pastries and cakes for any occasion. Specialty Cakes ..."
"Baked & Wired - Washington, DC Bakery - Georgetown",https://bakedandwired.com/,Baked & Wired is a family owned coffee shop and bakery located in Georgetown. All of our baked goods are made in small batches with the finest ingredients.
Home - Schwartz Bros BakerySchwartz Bros Bakery,https://www.schwartzbrosbakery.com/,"Baked Goods. We use only the best ingredients, usually working in small batches, from scratch recipes. We take our time and bake with care, often hand ..."
Whisked! | Online Bakery | Online Bakery Delivery – Whisked ...,https://www.whiskeddc.com/,"Whisked is an award winning online bakery that delivers desserts across the nation. Check out our pies, cookies, and gift boxes and order one today!"
Good Cakes and Bakes,https://goodcakesandbakes.com/,"Order Ahead. Place an order online and pick it up at your desired time from our bakery. ... We Ship Whole Cakes. Yes, it's true! We ship nationwide, so you can ..."
Krumville Bake Shop,https://www.krumvillebakeshop.com/,"Welcome to Krumville a Gluten-free Online Bakery in Brooklyn, NY. NEWS!! Our Bakery is currently closed. ... Shop For Daily Gluten Free Baked Goods ..."
"GK Baked Goods - Artisan Bakery in Fort Wayne, Indiana",https://gkbakedgoods.com/,"Bringing the big city to Fort Wayne with high-quality, refined pastries and mouth-watering baked goods. Shop online for in-store pickup or delivery through ..."
"Leo's Bakery and Deli | Bakery - Rochester, NY",https://leosbakeryanddeli.com/,What's the Best Thing About Leo's? EVERYTHING! Leo's is now offering online ordering for pickup or delivery. Pickup orders for café items and custom cakes can ...
Porto's Bakery – Welcome to Porto's Bakery & Cafe,https://www.portosbakery.com/,"If you have any trouble placing an online order, you are welcome to come ... Porto's Bakery was born out of Rosa's love for sharing her wonderful cakes and ..."
Stir Crazy Baked Goods,https://www.stircrazybakedgoods.com/,Now Accepting Online Orders! Click Here To Order Today! ... Stir Crazy Baked Goods. 1251 W. MAGNOLIA AVE. FORT WORTH TX 76104.
Shop Savage's Bakery Online!,https://www.shopsavagesbakery.com/,"Savage's Bakery is located in Homewood, AL and has been family owned and operated since 1939. Order our made from scratch cookies, cakes, pastries and more ..."
Beth's Little Bake Shop,https://bethslittlebakeshop.com/,Beth's Little Bake Shop brings a classical technique and European flavors to Evanston. We're located just east of the Metra station on Central Street.
"Addinnella Baked Goods, LLC",http://www.addinnella.com/,"Addinnella.com: South Carolina Online Bakery for Custom Decorated Cookies, Logo Cookies, Cakes and Cupcakes, Drop Cookies and more."
"1-800-Bakery.com - Birthday cake delivery, desserts and ...",https://www.1-800-bakery.com/,"I back every order with a 100% Satisfaction Guarantee, because I know our gourmet cakes, cookies and other desserts have been baked fresh just for you. At 1-800 ..."
Rustic Bakery | Organic Fine Foods and Baked Goods,https://rusticbakery.com/,Rustic Bakery has been serving quality handmade baked goods since 2005. Visit one of our four Marin County cafés or order online. © 2022 Rustic Bakery.
Bird-in-Hand Bake Shop - Homemade Bake Goods,https://bihbakeshop.com/,"We specialize in making delicious, homemade baked goods that are unlike anywhere else! At the Bird-in-Hand Bake Shop, we have a large selection of breads, ..."
PieconicNY - Online / Mail Order Pie & Baked Goods,https://www.pieconicny.com/,"PieconicNY is an artisan bakery in New York's Hudson Valley creating handwrought pies, quiche, muffins, cookies, pot pies and other baked delights."
"Dewey's Bakery: Moravian Cookie Thins, Sugar Cake, ...",https://deweys.com/,"Dewey's Bakery has been crafting Moravian Cookie Thins, Sugar Cake and other treats in Winston-Salem, NC since 1930. We ship sweet baked goods nationwide."
Tilda's Bake Shop,https://www.tildas.com/,Tilda's bake shop is located in Rocky Point and has been serving the North Shore of Long Island since 1955.We sell some of our baked goods as well as baking ...
Penn Street Bakery - Order Gourmet Baked Goods & Desserts ...,https://pennstreetbakery.com/,"Shop the best gourmet desserts & baked goods. Based in the USA - Delivered Nationwide. Freshness Guaranteed! Send cookies, cakes & more!"
Sugar Bakery & Cafe,https://sugarbakerycafe.com/,"DELIVERy: UberEats, doordash, Grubhub, Online ... Order FAQ · Custom Printed Sugar Cookies · CUSTOM PRINTED CAKES · Composting · Cookie Baking Instructions ..."
Apple Annie's Bake Shop,https://www.appleanniesbakeshop.com/,Your neighborhood bakery is the place to be. ... Annie's Bake Shop hasn't just harbored an insatiable sweet tooth and love of freshly baked goods – it's ...
Pastries by Randolph | Bliss in Every Bite | Arlington VA,https://www.pastriesbyrandolph.com/,"Known for delicious cakes, ""amazing"" French and Italian pastries, and super-elegant wedding cake creations, Pastries by Randolph has been a local favorite ..."
Aggies Bakery: Cakes & Bakery Delivery Milwaukee ...,https://www.aggiesbakery.com/,Milwaukee's best cakes & bakery delivery service! Shop and order online for pick-up or delivery to all of Milwaukee! Amazing cakes and bakery since 1977!
"Baked by Yael: Nut-free, kosher Cakepops, Bagels & Other ...",https://www.bakedbyyael.com/,"Try our Vegan Reuben and other Bagel Sandwiches! Order Now. Order Nut-free, Kosher Baked Goods & More."
Baked NYC,https://bakednyc.com/,"We are also a full-fledged lab of sorts, creating better baking mixes. SHOP NOW ... Baked cakes, made from scratch in our Brooklyn bakery, are perfect for"
Tate's Bake Shop: Craft Baked Cookies and Gift Baskets,https://www.tatesbakeshop.com/,"Baked goods from Tate's Bake Shop are perfect for any occasion. Shop our selection of cookies, gift baskets, and more!"
MB BAKERY ON THE GO | Alexandria Baked Goods Delivery,https://www.mbbakeryonthego.com/,"The best bakery in Alexandria! We deliver fresh baked goods from Crystal City to Mount Vernon. Online ordering available for our decorated cookies, pies, ..."
Lee Lee's Baked Goods | The most outrageously delicious ...,https://leeleesrugelach.com/,"Aug 14, 2012 — Taste the difference between store-bought baked products and Lee Lee's Baked Goods' homemade rugelach in New York."
Sift Bake Shop,https://www.siftbakeshopmystic.com/,"French inspired bakery located in historic downtown Mystic, CT. The bakeshop, owned and operated by Pastry Chef Adam Young, will feature a wide variety of ..."
Blue Gate Bakery Online,https://www.bluegatebakery.com/,"Our Shipshewana Bakery features shelves and shelves of the finest Amish hand-made baked goods in the area. From breads and cookies to pies and pastries, ..."
Bread and Roses Bakery in Maine | Take Out and Shipping ...,https://www.breadandrosesbakery.com/,"From scratch bakery offering cakes, pies, coffee, desserts, breakfast. Take out from Wells, Maine location or ship nationwide with Goldbelly."
"Portland Bakery Delivery - Cakes, Pies, Cookies by Portland ...",https://www.portlandbakerydelivery.com/,"Order baked goods online from your bakery in Portland, OR. Portland Bakery Delivery, offers fresh pastries and cakes hand delivered right to your door in ..."
The Pennsylvania Bakery: Home,https://pabakery.com/,"Delivery of Wedding Cakes is priced separately. Learn More. Coffee Shop Delights. Come in, spend time with family and friends, and treat yourself ..."
Wholesome Bakery: Hello,https://wholesomebakery.com/,Now taking requests and offering tastings for Custom Cakes serving parties of 35 or more ... Those are my go-tos when I order online or pop into the bakery.
Cheryl's: Cookie Delivery | Cookie Gifts | Gourmet Desserts,https://www.cheryls.com/,"Within seven years, the company had grown by leaps and bounds, broadening its assortment to include gourmet brownies, cakes, cookies and cookie gift baskets, ..."
Little Bird Bakeshop,https://www.thelittlebirdbakeshop.com/,Order Online. flower-divider.png. little-bird-soup.jpg. WE ARE A 100% from scratch bakery in THE HEART OF Old Town Fort Collins.
Bake Me A Wish!: Birthday Cakes Delivered | Bakery Gift ...,https://www.bakemeawish.com/,"Bake Me A Wish! gourmet cakes and bakery gifts are delivered overnight, nationwide. All Bake Me A Wish! gifts can be sent for nationwide delivery and ..."
Baked and Co | Best Bakery In Sydney | Baked Goods Delivery,https://bakedandco.com.au/,"Our artisan bakery in Sydney produces fresh, tasty bread, pastries and donuts, along with our gift boxes. Order yours online today."
Fay Da Bakery - Order cakes online!,https://fayda.com/,Order cakes online!
Order Delivery & Takeout From Buzz Bakeshop Alexandria ...,https://buzzbakeshop.com/,"Buzz Bakeshop is a beloved neighborhood bakery with locations in Alexandria and Arlington featuring a myriad of sweets, pastries, cakes, coffee and much more."
Pushkin's Bakery | Gluten free fresh baked goods in ...,https://pushkinsbakery.com/,"Wheat/gluten and dairy-free baked goods located in downtown Sacramento, CA."
Home | Shop Get Caked Bakery Online,https://www.getcakedroc.com/,"Birthday cakes, cupcakes, cookies, wedding cakes, specialty desserts, custom cakes, graduations, showers; allergy friendly options."
Red Ribbon Bakeshop | Order Your Favorite Treats Online ...,https://redribbonbakeshop.us/,At Red Ribbon our goal is to make every family celebration truly special by creating delicious and beautiful cakes. Order your favorite treats online!
Baked on 8th,https://www.bakedon8th.com/,"Cakes, Cookies, Pies and More! We make custom cakes and cookies for birthdays, baby showers, engagements, weddings and every celebration, fresh baked."
Barrett's Baked Goods Cakes Desserts - Buford - Flowery ...,https://barrettsbakedgoods.com/,"Creators of custom cakes, cupcakes, pastries and desserts for weddings and special events throughout Buford, Gainesville, Flowery Branch, Braselton and ..."
"Sweet Street Desserts: Buy Cupcakes, Desserts ...",https://www.sweetstreet.com/,"Sweet Street Desserts offers an evolving, extraordinary online selection of luscious gourmet cupcakes, desserts, gourmet pies, cakes, dessert bars, ..."
Bernice's Bakery: Home,https://bernicesbakerymt.com/,"Bernice's Bakery puts good food and community in everything we do. Keeping Missoula sweet since 1978. ... ORDER ONLINE. Sustainable Practices, Products, & ..."
"Pittsburgh Bakery and Desserts, Cakes; Pastries A-La-Carte",https://pastriesalacarte.com/,"Brownie Cakes. Not only do we offer delicious cookie cakes, but we offer brownie cakes as well! Call today to place a custom order or order one online ..."
Ovenly Store,https://oven.ly/,"Cakes, cookies, scones, muffins, cupcakes, and more. ... Pre-order for pickup or delivery at any bakeshop with 4-days notice. order now ..."
